ID,Title,Location,Salary,Summary
https://kr.indeed.com/viewjob?jk=232d303badc95396,JAVA 경력 정규직,브라이트컨설팅 과천 과천시,,"브라이트컨설팅 JAVA 경력 정규직 채용 모집부문 및 자격요건 담당업무... 프로젝트 설계 및 개발 수행 [관련경력 5년 이상] [필수/우대사항] (필수) Java, JSP, Spring Framework (3년 이상) (필수..."
https://kr.indeed.com/viewjob?jk=edc6e7f0577700a0,"JAVA, JSP 외 경력 정규직",콜라비 서울 금천구,,JAVA|인터넷·IT·통신·모바일·게임>웹프로그래머>JSP|인터넷·IT·통신·모바일·게임>웹프로그래머>Servlet|인터넷·IT·통신·모바일·게임>웹프로그래머>AJAX|인터넷·IT·통신·모바일·게임>응용프로그래머> JAVA...
https://kr.indeed.com/viewjob?jk=2e076dbc3e3352db,[개발자 단독 사무실 제공] PHP 개발자 / 안드로이드 앱 개발자 /웹...,더퍼스트인베스트먼트 서울 금천구,,게임>웹프로그래머>PHP |인터넷·IT·통신·모바일·게임>웹프로그래머> JAVA|인터넷·IT·통신·모바일·게임>웹프로그래머>프론트엔드|인터넷·IT·통신... 통신·모바일·게임>응용프로그래머> JAVA|인터넷·IT·통신·모바일·게임...
https://kr.indeed.com/viewjob?jk=b6e8d8a562f8ed54,IT부문 신입/경력직원,유안타증권 대한민국,,"해당분야 대리/과장급 경력자(경력 3년 이상) · 파생상품 업무 이해 능력을 보유한 자 · Pro*c, java, jsp, PL/SQL 사용 능력을 보유한 자 · CFD(차액결제 시스템) 유경험자 우대 · IT관련 전공자 및..."
https://kr.indeed.com/viewjob?jk=93596c684023eea6,[서울지사][던파모바일2D] 웹개발자,네오플 제주도,,긍정적인 협업 태도와 업무에 열정을 가지신 분 우대사항 - 게임 로그 데이터 처리 경험 - Node.js/ Java를 이용한 웹서버개발 실무 경험을 보유하신 분 기타사항 ※ 본 채용은 네오플 서울지사로 입사를 희망하는 인원...
https://kr.indeed.com/viewjob?jk=cafdf5d02c1453ae,WINDOW ASP MSSQL JAVA 개발자 모집,웰브릿지 서울 서초구,"연봉 55,000,000원 - 60,000,000원",사원수 80명 회사주소 서울특별시 서초구 서초대로56길 34 202호 웰브릿지 WINDOW ASP MSSQL JAVA 개발자 모집 모집부문 및 자격요건 모집부문 담당업무 자격요건 우대조건 구분 : [미입력] 채용직급 : 면접...
https://kr.indeed.com/viewjob?jk=41a3c612bb095e66,"경력직원 수시 (IT본부, 대체투자본부)",KIS채권평가 대한민국,,을 이용한 API 개발 및 운영 -Django(Python)으로 개발된 시스템 운영 *필요 직무 능력: 1. Java 2. Spring Boot(Spring Framework)을 이용한 개발 경험 3. DB(Oracle...
https://kr.indeed.com/viewjob?jk=e4e15edf1b824d23,"INFA 대출인바운드 상담 , 프로그램개발자c++상 java상 경력 외...",드림파트너스 서울 노원구,,제목 회사소개 근무조건 근무지 : 서울 > 노원구 > 의정부 근무요일 : 주5일 근무시간 : 09시 00분 ~ 18시 30분 급여 : 평균 300만원이상 (기본급+인센티브)/개발자 통계가능자(경력직) 급여 : 평균400만원이...
https://kr.indeed.com/viewjob?jk=5f3fbbcdfba8965a,JT친애저축은행 [업무개발자] 경력직원,JT친애저축은행 서울,,선임 / 일반 공통 - JAVA / JSP (프레임워크(spring) 및 솔루션 기반) 금융 여/수신 업무 개발 [자격요건]· 선임 개발자 : 경력 7년 이상· 일반 개발자 : 경력 3년 이상· JAVA / JSP 사용 개발...
https://kr.indeed.com/viewjob?jk=534cf1c58be224ca,[해외취업] 현대·기아 협력사 IT부문 인턴사원,사이다링크 서울 논현동,"연봉 37,250,000원","Social media advertising, management - HTML , CSS , JAVA , JAVASCRIPT , MS OFFICE - U.S. Driver's license 그 외 자격요건..."
https://kr.indeed.com/viewjob?jk=62cbe15e35cc7fab,[내일애-2차 청년스타트업] (주)로킷헬스케어 해외BD/Bio연구/Sof...,로킷헬스케어 서울 금천구,,"생물학 관련 전공, 석사 우대 3) Software개발 : Windows 어플리케이션 개발 경험자/ C#, JAVA,파이썬등 프로그래밍 언어 능숙자 4) 유전자분석 : Cell CULTURE, DNA/.RNA prep..."
https://kr.indeed.com/viewjob?jk=20f93a3228ce0984,[FAVIS] S/W개발 (FA머신비전) 엔지니어 정규직 신입,파비스 서울 금천구,"연봉 28,000,000원 - 29,000,000원",비희망 [기타 우대내용] 해외여행 및 지방근무 결격사유가 없는 자 인터넷·IT·통신·모바일·게임>응용프로그래머>C·C++|인터넷·IT·통신·모바일·게임>응용프로그래머> JAVA|인터넷·IT·통신·모바일·게임>응용프로그래머>C#
https://kr.indeed.com/viewjob?jk=a2239ac86e15b7cc,[AI와 블록체인] 보안기술연구원,시큐어링크 서울 구로구,,있습니다. 인터넷·IT·통신·모바일·게임>응용프로그래머>C·C++|인터넷·IT·통신·모바일·게임>응용프로그래머> JAVA|인터넷·IT·통신·모바일·게임>응용프로그래머>Android|인터넷·IT·통신·모바일·게임>응용프로그래머...
https://kr.indeed.com/viewjob?jk=4e647eebcae04884,[신입/경력] 안드로이드 앱 개발자,파인헬스케어 서울 성동구,,ㆍ경력 : 상용업체 경력 1년이상우대사항ㆍ컴퓨터공학 유관학과 전공자ㆍAndroid 플랫폼에 대한 높은 이해도ㆍ Java/Kotlin 개발가능ㆍReact Native/Flutter 등 크로스 앱 개발 가능ㆍNDK 개발 경험ㆍ모바...
https://kr.indeed.com/viewjob?jk=1ffb05e65fe7bc13,BI 분야 PM / PL / 개발직,비아이매트릭스 서울,,"력자(개발이 가능한 IT컨설턴트) - JAVA/JSP, javascript, VB, VBA 등 개발자 ( JAVA/JSP 등 프로그래밍 가능자 및 VB... JAVA/JSP, javascript, VB, VBA 등 개발자 ( JAVA..."
https://kr.indeed.com/viewjob?jk=fb5abc0e80ec2f65,한국공장 IT엔지니어 경력사원,한화솔루션 충청북도 진천,,기술·화학·연구개발>전자·반도체>반도체|인터넷·IT·통신·모바일·게임>응용프로그래머>C#|인터넷·IT·통신·모바일·게임>응용프로그래머> JAVA|인터넷·IT·통신·모바일·게임>네트워크·서버·보안>Windows계열 서버운영·관리
https://kr.indeed.com/viewjob?jk=89629be6c1a169a2,java 프로그램 개발자(신입),한울아이씨티 서울 종로구,"연봉 25,000,000원","외국어 능력, 컴퓨터 활용, 채용가능 장애유형, 장려금 지급 대상자 채용희망 등 구인정보 상세 확인 모집직종 JAVA 프로그래밍 언어 전문가 모집인원 5명 학력 대학_대학교 전공 전산학·컴퓨터공학 고용형태 상용직 근무예정지..."
https://kr.indeed.com/viewjob?jk=cdc691cace5e9b21,"WEB개발(JAVA, JSP) 경력 정규직, 프리랜서",에이앤티솔루션 성남 분당구,,"0명모집영역 : - WEB개발자( JAVA, JSP): 0명(경력:3년 이상... 채용이 취소될 수 있습니다. 인터넷·IT·통신·모바일·게임>웹프로그래머> JAVA|인터넷·IT·통신·모바일·게임>웹프로그래머>JSP|인터넷·IT·통신..."
https://kr.indeed.com/viewjob?jk=216f5b68bd2932ac,정규직 개발자1명과 실무자1명,제노테크 광주 광산구,,[응용 프로그래밍] - JAVA 개발 - 응용프로그램 개발 - DB 설계 및... 및 자격요건 담당업무 자격요건 인원 [담당업무] [응용 프로그래밍] - JAVA 개발 - 응용프로그램 개발 - DB 설계 및 컨텐츠 개발 - 프레임워...
https://kr.indeed.com/viewjob?jk=143311442bd55ffa,"에이아이더뉴트리진 AI사업부(역삼역) [ 보충역 iOS, Spring 백...",에이아이더뉴트리진서울사무소 서울 강남구,"연봉 25,000,000원 - 30,000,000원","[웹프로그래밍] - jsp, java, ASP / PHP 개발 능숙자 - HTML, JavaScript, css 능숙자 - MS SQL, Oracle, MySQL 등 DBMS 설계 및 운영 가능자 - 웹, DB서버 구축 및..."
https://kr.indeed.com/viewjob?jk=2877c86e190844ed,웹(WEB)/자바(JAVA) 개발 및 운영담당자 [신입/경력 ],기웅정보통신 서울 금천구,,기웅정보통신(주) 웹(WEB)/자바( JAVA) 개발 및 운영담당자 [신입/경력 채용] 모집부문 및 자격요건 담당업무 자격요건 인원 [담당업무]자사 전자증빙 서비스 기능 개발/개선/장애대응[근무부서 및 직급/직책]근무부서...
https://kr.indeed.com/viewjob?jk=3841ef26345e1c99,"JAVA, 웹개발 경력 정규직, 계약직, 프리랜서 - 외국계 금융회사 개...",씨앤노마드 서울 중구,"연봉 60,000,000원 - 70,000,000원","금융회사 운영 경험자 주식회사 씨앤노마드 JAVA, 웹개발 경력 정규직, 계약직... 정보- DB: oracle- WEB: WebToB... jeus- java, spring framework, Mybatis, ax5ui (ax5..."
https://kr.indeed.com/viewjob?jk=8d9886b30bd6638f,Application(앱) 개발자 정규직(경력사원) 모집,GS건설 3.4 서울 종로구,,"자격요건 1. 정규 4년제 대학졸업자 (전공 무관) 2. 프로그램 개발 기술 보유 (Python, C/C++, Java, Kotlin, Swift, Javascrip 등) 3. App.개발(Android 및 iOS), Web..."
https://kr.indeed.com/viewjob?jk=d917ed88ea21fd17,[ 아이콘트롤스 ] 2020년 경력 직원 (기술연구소) 연구개발부문,HDC아이콘트롤스 성남 분당구,,"이상 - 프로그램 개발(Python, Java) 능력 보유 - 대용량 데이... 대한 유경험자 우대 -Android Native App 개발역량 보유 - JAVA, Kotlin 을 활용한 상용화 개발 역량 (AWS 유경험자 우대..."
https://kr.indeed.com/viewjob?jk=241ae1e7499c461c,Security Engineer (모의해킹/취약점 점검),Toss 서울 강남구,,"킹대회 우승 경력이 있는 분 - 다양한 플랫폼 보안 진단 경험이 있는 분 - Python, C, C++, C#, JAVA 중 프로그래밍 언어에 능숙 하신 분 # 현업 인터뷰 - 결제 산업의 미래, 토스가 새롭게 만들어 갑니다"
https://kr.indeed.com/viewjob?jk=8808280281200007,한국공장 IT엔지니어 경력사원 채용,한화그룹 4.2 서울,,"및 조치 - 유관 업무 5년~8년 경력자 - 반도체, 태양광 등 하이테크 산업 경험자 - C# 및 Java 개발 중급 이상 - SECS 또는 PLC Driver 통신 개발 경험자 - TIBCO Rendezvous..."
https://kr.indeed.com/viewjob?jk=88898239e74f518a,"[웹개발(Java/JSP) 개발 경력직], [IT 웹기획 경력자 (대리급...",케이투웹테크 강원도 원주,,인터넷·IT·통신·모바일·게임>웹프로그래머>웹개발|인터넷·IT·통신·모바일·게임>웹프로그래머> JAVA
https://kr.indeed.com/viewjob?jk=89c576b4895e33f6,KT (주)자바모바일 소사장님,자바모바일 인천 계양구,,"담당업무 매장운영 모집인원 명 근무형태 추후협의 급여사항 협의 후 결정 자격요건 성별 무관 나이 무관 학력 무관 경력 1년 상세모집내용 * 전화 문의 시 ""모비잡 채용정보 보고 전화드렸습니다."" 라고 말씀해주세요. 접수기..."
https://kr.indeed.com/viewjob?jk=1777e605b7d9d1c5,국내 대기업 계열사 - Java기반 웹개발 경력자(과장-부장),라피플코리아리미티드 서울,,- 관련경력 7년~15년 - java 기반 웹개발 경력자 - java Spring... 담당업무] - Java 기반 웹개발 [자격요건] - 관련경력 7년~15년 - java 기반 웹개발 경력자 - java Spring Boot 경험자...
https://kr.indeed.com/viewjob?jk=d4562aa0d1d7c09d,[정규직] 제조(Hi-Tech) 품질/장비 개발전문가,SK 씨앤씨 4.0 서울,,"스템 표준화 및 PI(Process Innovation)업무, 관련 솔루션 또는 시스템 개발/운영 - C#, JAVA 개발경험 5년 이상 / DB 모델링 1. 채용분야 경력 최소 3년 이상인자 2. 남자는 병역필 또는 면제..."
https://kr.indeed.com/viewjob?jk=5cb8b6806a9b5a63,[(주)프리뉴] 소프트웨어 개발 경력직,프리뉴 안산 단원구,,"직급/직책: 전임연구원, 선임연구원 [자격요건]- C/C++, C#, Java 언어중 하나 이상 가능자- 네트워크, 멀티쓰레드, 비동기 IO 개발... 통신·모바일·게임>응용프로그래머> JAVA|인터넷·IT·통신·모바일·게임..."
https://kr.indeed.com/viewjob?jk=4123876dfea9b710,윈도우 응용소프트웨어 개발외 각 부문,씨케이다 서울 금천구,,"전공 : 컴퓨터 공학 관련학과 필수요건 - ASP, JSP, PHP, Java, MySQL, Javascript 개발가능자 - 소프트웨어공학 실무우대... 통신·모바일·게임>웹프로그래머> JAVA|마케팅·광고·홍보·조사>마케팅>해외마케팅"
https://kr.indeed.com/viewjob?jk=5f3fbbcdfba8965a,JT친애저축은행 [업무개발자] 경력직원,JT친애저축은행 서울,,선임 / 일반 공통 - JAVA / JSP (프레임워크(spring) 및 솔루션 기반) 금융 여/수신 업무 개발 [자격요건]· 선임 개발자 : 경력 7년 이상· 일반 개발자 : 경력 3년 이상· JAVA / JSP 사용 개발...
https://kr.indeed.com/viewjob?jk=b86da88c2546f564,"Software Engineer, University Graduate",Google 4.3 서울,,"purpose programming languages, including... limited to: Java, C/C++, Python, JavaScript, or Go. Experience working..."
https://kr.indeed.com/viewjob?jk=5dff558bea05fb35,클라우드 아키텍트,Nexon 성남 분당구,,"Cloud 기반 상용 솔루션/서비스 Workload 최적화 및 Architecture 개선 경험 - Java, C/C++ 등 프로그래밍 역량 및 상용 솔루션/서비스 프로그램 개발 경험 우대사항 - 학력/전공: 학사 이상..."
https://kr.indeed.com/viewjob?jk=089931931a0474d5,소형전지사업부/기술혁신센터,삼성SDI 3.9 충청남도 천안,,"OHT 등) 천안 전공분야 - 컴퓨터/시스템 전자/전기 기계/산공 전문지식 - Java, C#, C++, Python - Oracle (PL/SQL) - Automod, VisualComponent..."
https://kr.indeed.com/viewjob?jk=2f1ee32a9dbceab0,배달의민족 사장님 대상 셀프서비스 서버 개발자,우아한 형제들 서울 송파구,,"지원자격] - 웹 어플리케이션 개발, 운영 경력 3년 이상이신 분(또는 그에 준하는 역량을 갖추신 분) - JAVA에 익숙하고, 그 외 언어(1개 이상)를 습득하신 분 - Spring 프레임웍(Spring Boot)을 이용한..."
https://kr.indeed.com/viewjob?jk=e88ae6e6999baee8,통신사 미디어 정산서비스 자동화 개발자 (java개발자),스퀘어네트 성남 분당구,,"우대사항] * 이동통신사 프로젝트 수행 경험자 스퀘어네트(주) JAVA, JAVA 경력 정규직 채용 모집부문 및 자격요건 담당업무 자격요건 인원... 웹프로그래머> JAVA|인터넷·IT·통신·모바일·게임>응용프로그래머> JAVA"
https://kr.indeed.com/viewjob?jk=3de0908753fc937b,삼성생명 IFRS 개발 및 운영,벨텍소프트 서울 강남구,,"사항: 경력(5년 이상 )학력사항: 학력무관직무기술: AA, DBA, JAVA개발 0 명 근무조건 고용형태: 계약직(근무기간 9개월), 프리랜서(근무... 통신·모바일·게임>웹프로그래머> JAVA|인터넷·IT·통신·모바일·게임>데이..."
https://kr.indeed.com/viewjob?jk=acefcdfbf995f667,[EY컨설팅] 컨설팅본부 코리아솔루션 인턴 모집,Ernst & Young 4.0 대한민국,,"운영 (RPA, Chatbot, AI 등) * 지원자격 - 응용 프로그램 설계 / 개발 / 운영 ( JAVA, C# 등) 가능자 - 디지털 솔루션 구축 / 운영 (RPA, Chatbot, AI 등) 가능자 - 대학 졸업..."
https://kr.indeed.com/viewjob?jk=ae341f1189b7b367,[내일애-2차 청년스타트업] 이크레모스 화성본사 웹개발자,이크레모스 경기도 화성,,"[우대사항] - 해당 업무 경력자 - jsp, java, ASP / PHP 개발 능숙자 - HTML, JavaScript, css 능숙자 - MS SQL, Oracle, MySQL 등 DBMS 설계 및 운영 가능자 - 웹..."
https://kr.indeed.com/viewjob?jk=f95cf22ffb0e400e,"C#, JAVA 개발자",마인정보기술 서울 서초구,,취소될 수 있습니다. 인터넷·IT·통신·모바일·게임>응용프로그래머> JAVA|인터넷·IT·통신·모바일·게임>응용프로그래머>.NET|인터넷·IT·통신... 웹프로그래머>JSP|인터넷·IT·통신·모바일·게임>웹프로그래머> JAVA
https://kr.indeed.com/viewjob?jk=1d15e5adc115c979,서비스 개발 및 운영 관리,아이엠비디엑스 서울 금천구,,"사용 기술linux, centos, pycharm, spring boot, java, jquery, apache http server, mariadb... 경험자Python, django, Java 및 framework 개발 경험..."
https://kr.indeed.com/viewjob?jk=40767ef4620ad53d,웹 개발자,도프네트웍 인천 연수구,"연봉 24,000,000원","모집직종, 모집인원, 학력, 전공, 고용형태, 근무예정지, 인근지하철, 직무내용, 경력조건, 필요경력, 자격면허, 병역, 병역특례, 외국어 능력, 컴퓨터 활용, 채용가능 장애유형, 장려금 지급 대상자 채용희망 등 구인정보..."
https://kr.indeed.com/viewjob?jk=78353e688ba8a77c,소프트웨어 개발자 신입/경력,핸디소프트 안양 동안구,,신입/경력 채용 인터넷·IT·통신·모바일·게임>웹프로그래머>백엔드|인터넷·IT·통신·모바일·게임>웹프로그래머> JAVA|인터넷·IT·통신·모바일·게임>ERP·시스템분석·설계>AWS|인터넷·IT·통신·모바일·게임>응용프로그래머>클라우드
https://kr.indeed.com/viewjob?jk=977c34e096023e2a,개발열정 가득한 C# / JAVA 개발자,피어라인 군포 산본동,,"멀티미디어 SW (팟플레이어, 곰인코더 등) 개발 역량 확보 가능 * 개발 환경 Flexible * C# 또는 JAVA 언어 필수 * DBMS(MySQL 또는 Oracle) 경험 및 이해도 * C++ 언어 우대 * WEB..."
https://kr.indeed.com/viewjob?jk=67ba3a5286bf7cd4,리액트 개발자 (신입),스플릿 서울 금천구,,"[웹프로그래밍] - jsp, java, ASP / PHP 개발 능숙자 - HTML, JavaScript, css 능숙자 - MS SQL, Oracle, MySQL 등 DBMS 설계 및 운영 가능자 - 웹, DB서버 구축 및..."
https://kr.indeed.com/viewjob?jk=802190804428af81,(주)자바모바일 _ KT대리점 소사장 및 직원,자바모바일 인천 서구,,"담당업무 대형마트 내 KT소매매장 운영 모집인원 5명 근무형태 추후협의 급여사항 협의 후 결정 자격요건 성별 무관 나이 무관 학력 무관 경력 1년 상세모집내용 * 전화 문의 시 ""모비잡 채용정보 보고 전화드렸습니다."" 라고..."
https://kr.indeed.com/viewjob?jk=9adbc290202846e1,[아이브릭스] 기업부설연구소 전문연구요원,아이브릭스 성남 분당구,,인터넷·IT·통신·모바일·게임>응용프로그래머>머신러닝(ML)|인터넷·IT·통신·모바일·게임>응용프로그래머> JAVA|인터넷·IT·통신·모바일·게임>응용프로그래머>자바스크립트|인터넷·IT·통신·모바일·게임>빅데이터·AI(인공지능...
https://kr.indeed.com/viewjob?jk=19b93db9fb547677,시크릿차트와 함께할 개발자,시크릿차트 서울 강남구,,요한 현 시점에서 당신이 꼭 필요합니다. Ios / Android / java / php / jQuery / MySQL / Redis / nginx... 있습니다. Ios / Android / java / PHP / jQuery...
https://kr.indeed.com/viewjob?jk=60c16fae444cf985,자바 Java 경력10년 이상 개발자 프로그래머,스마트컨버전스 수원 영통구,,"자바 Java 경력10년 이상 개발자 프로그래머 모집부문 및 자격요건 담당업무 자격요건 인원 [담당업무] JSP, JQUERY, Java script... JAVASCRIPT, 자바, JAVA, JQUERY [우대사항] 전공계열..."
https://kr.indeed.com/viewjob?jk=57bffe2e297646f8,"(주)데이타뱅크시스템즈 신입, 경력직",데이타뱅크시스템즈 대구 남구,,"[웹프로그래밍] - jsp, java, ASP / PHP 개발 능숙자... 가능자 - 웹, DB서버 구축 및 유지 가능자 [웹프로그래밍] - jsp, java, ASP / PHP 개발 능숙자 - HTML, JavaScript..."
https://kr.indeed.com/viewjob?jk=25dff5df03f977fc,IT 품질관리 경력사원 채용,한화그룹 4.2 서울,,"험자 [우대요건] DDD, MSA, Agile 경험자 우대 CBD기반 모델링도구 커스터마이징 가능 인력 우대 Java 개발 경험자(3년 이상) 우대 0명 서울 여의도 '1:1 문의하기' 등록 응시 자격 해외 여행에 결격사..."
https://kr.indeed.com/viewjob?jk=e6e3a5effcabf894,TOAST CAM 개발자,NHN 4.4 성남 판교역,,서버 개발] Job Description 자격요건 우대사항 - Java 스프링 프레임워크 기반 서버 개발 - 분산/대용량 서비스 구축/운영 - Java 개발 경력 5년 이상 - 분산/대용량 처리 기술 보유자...
https://kr.indeed.com/viewjob?jk=4ec305f59ce64060,게임이상탐지 분석/개발,Nexon 성남 분당구,,"선택) DB 활용 및 대시보드 개발 능력 솔루션 개발자 - 한 가지 이상의 개발 언어(Python, Java, Scala)에 숙련된 프로그래밍 능력 - Linux 환경에서의 개발 능력 - 빅데이터 분석 플랫폼 기반의..."
https://kr.indeed.com/viewjob?jk=9ad69908bff20bbe,JAVA 경력 계약직,이에스소프트 서울 금천구,"연봉 30,000,000원 - 35,000,000원","(주)이에스소프트 JAVA 경력 계약직 채용 모집부문 및 자격요건 담당업무 자격요건 인원 [담당업무]증권회사 고객맞춤서비스 개발, 증권업무 경력 불필요... 취소될 수 있습니다. 인터넷·IT·통신·모바일·게임>웹프로그래머> JAVA"
https://kr.indeed.com/viewjob?jk=7f9954e4382f47b0,프론트엔드 개발자,우리사이 서울 성수동2가,,Cordova 및 기타 하이브리드앱 개발 경험 - Web Application 설계 및 개발 경험 - Java Spring 개발 경험 - 애자일한 근무환경으로 디자이너와 원활한 코웍우대사항 <근무환경> 장소 : 성수 종합...
https://kr.indeed.com/viewjob?jk=9da55c142bcdebd5,(국내 최고회사) Front End 개발자,인코리아 프로페셔널 성남 분당구,,있으신 분학력사항: 대학교(4년)졸업 0 명 인터넷·IT·통신·모바일·게임>웹프로그래머>HTML·DHTML·mHTML|인터넷·IT·통신·모바일·게임>웹프로그래머> JAVA|인터넷·IT·통신·모바일·게임>웹프로그래머>프론트엔드
https://kr.indeed.com/viewjob?jk=b482db75bd81046e,(사)한국디지털기업협회 UIUX분야 or 프로그래밍 전문 강사님,한국디지털기업협회 디지털인재개발원 서울 강남구,,"격요건 인원 [담당업무] * UI 구현 및 UIUX 콘센트 기획 또는 * 프로그래밍 언어 활용 (SQL, JAVA 등) 강의 [자격요건] 경력사항: 경력(2년 이상) 직무기술: 기획 UIUX, UI 퍼블리싱, 프로그래..."
https://kr.indeed.com/viewjob?jk=01455f89ee27ebe4,2021년 (주)퍼브 개발 신입/경력,퍼브 서울 강서구,,인터넷·IT·통신·모바일·게임>웹프로그래머>웹개발|인터넷·IT·통신·모바일·게임>응용프로그래머> JAVA
https://kr.indeed.com/viewjob?jk=09e37afaced8a278,(경력직) Java 개발자 정규직,인사이트온 서울 강남구,"연봉 44,000,000원 - 46,000,000원","지원자격 경력 신입·경력 학력 - 성별 무관 기타 담당업무 대기업 시스템 소프트웨어 개발 Java 개발 상세모집요강 접수기간/방법 지원방법 전형절차 및 제출서류 제출서류 이력서에 응시분야, 연락처, 희망연봉 기재 직무..."
https://kr.indeed.com/viewjob?jk=0ff882ab8b8b7035,웹 서비스 개발자,오지다 대한민국,"연봉 24,000,000원 - 26,000,000원","절차 및 제출서류 제출서류 이력서에 응시분야, 연락처, 희망연봉 기재 직무/산업 직무별(직종) 콘텐츠.사이트운영디버깅 웹프로그래머웹프로그래머, ASP, JSP, JAVA, Servlet, CORBA, PHP, CGI, XML"
https://kr.indeed.com/viewjob?jk=5a41599c2129531d,[현대중공업] 특수선) 2020년 경력사원,한국조선해양 대한민국,,희망업무 자격요건 주요업무 근무지 모집 인원 함정설계 (경력) 정규직 조선 CAD 융합기술 개발 ㆍC# 또는 JAVA 프로그램 경력 3년 이상 ㆍAM(AVEVA MARINE) 프로그램 개발 우대 ㆍ오라클 기반 개발 경험...
https://kr.indeed.com/viewjob?jk=4a59ddd08fd9e751,"웹개발, JAVA 경력 계약직, 프리랜서",씨케이하나 경기도 이천,,"(주) 씨케이하나 웹개발, JAVA 경력 계약직, 프리랜서 채용 모집부문 및 자격요건 담당업무 자격요건 인원 [담당업무]UNIX 환경에서 Java 개발.기간... 웹프로그래머>웹개발|인터넷·IT·통신·모바일·게임>웹프로그래머> JAVA"
https://kr.indeed.com/viewjob?jk=c00c9362fd0ab744,"[아이티기술]PLM 개발/웹 개발자 정규직 (JAVA, PLM 솔루션)-...",아이티기술 서울 수서동,,"모집직종 JAVA 프로그래밍 언어 전문가 관련직종 컴퓨터시스템 설계 및 분석가 직무내용 JAVA 프로그래밍, 프로세스 혁신 컨설팅, 시스템 구축... Teamcenter ] [ JAVA ] 우대사항 우대사항 외국어능력 - 전공..."
https://kr.indeed.com/viewjob?jk=a7b7e9d4007b23a5,[삼성SDS 근무] Web어플리케이션 JAVA 개발자,리버스아이티 수원 영통구,,솔루션개발자 모집/ JAVA/ JSP) 삼성SDS수원 모집부문 및 자격요건 담당업무 자격요건 인원 [담당업무]웹솔루션 개발 ( JAVA/JSP)[근무부서... 통신·모바일·게임>웹프로그래머> JAVA|인터넷·IT·통신·모바일·게임>웹프...
https://kr.indeed.com/viewjob?jk=b25baa813b3549cb,웹개발 경력인재 - 코스닥상장 우량회사,에스에프인촌 서울 구로구,,바일·게임>웹프로그래머>JSP|인터넷·IT·통신·모바일·게임>웹프로그래머> JAVA|인터넷·IT·통신·모바일·게임>웹프로그래머>백엔드|인터넷·IT·통신... 통신·모바일·게임>응용프로그래머> JAVA|인터넷·IT·통신·모바일·게임...
